{"$schema":"urn:programmable:applicant-compatibility:1.0.0","application":{"contractId":"public-pr-application-v3.1","schemaPath":"intake/schemas/public-pr-application-v3.schema.json","schemaSha256":"sha256:2d51837bbbfe52672ecca334596243bebcec78e8e0a885d67084dfd98955bcb7"},"capabilities":{"draftTransportOperations":["create","update"],"missingObjectRecovery":true,"sourceClosureModes":["inline","manifest"],"unreviewedDraftOnly":true},"kind":"programmable-applicant-compatibility","minimumBuilderProtocolVersion":"1.0.0","schemaVersion":"1.0.0","trustedRepository":{"defaultBranch":"main","numericId":"1320171831"},"validatorPackage":{"closureSha256":"sha256:3ba5ac5639cd7b813f713b321a430cb1b510128011bed845b4e276534255df77","entrypointPath":"vendor/programmable-applicant-validator/scripts/public-applicant-validator.mjs","receiptPath":"vendor/programmable-applicant-validator/validator-package-receipt.v1.json","rootPath":"vendor/programmable-applicant-validator"}}
